{
  "protocolVersion": 1,
  "requestId": "compress-1",
  "operation": "compress",
  "arguments": {
    "planId": "plan-01HQ8Z3M4K5N6P7Q",
    "journalDirectory": "L2hvbWUvZXhhbXBsZS8ubG9jYWwvc3RhdGUvZGlza3RvcA==",
    "homeTrashDirectory": "L2hvbWUvZXhhbXBsZS8ubG9jYWwvc2hhcmUvVHJhc2g=",
    "destinationDirectory": "",
    "sourceDisposition": "trash",
    "targets": [
      {
        "path": "L2hvbWUvZXhhbXBsZS8uY2FjaGUvcGlwL2h0dHAtdjIvYTE=",
        "expected": {
          "device": "66306",
          "inode": "1179651",
          "mountId": "29",
          "kind": "directory",
          "apparentBytes": "4096",
          "modifiedNanoseconds": "1758000000123456789"
        },
        "reviewedBytes": "7314112512"
      }
    ]
  }
}
